{
  "schemaVersion": 1,
  "runId": "orun-focused_expansion-50dc1733c585",
  "mode": "focused_expansion",
  "plannerVersion": "corpus-planner-1",
  "policyId": "corpus-policy-v1-default",
  "policyVersion": "1.1.0",
  "inputSnapshotId": "snapshot-1.0.0-production-scale-500-82083c64e86c",
  "outputSnapshotId": null,
  "seed": "controlled-scale-500-v1:1.0.0:scale-500-tranche-02-lunch-dinner:dinner-700-799:sha256:82083c64e86c7fae93a1e680488469ec01bf8914cb734029816bd0abf88e9fa8",
  "goal": {
    "targetRecipeCount": null,
    "acceptedAddCount": 10,
    "maxJobs": null,
    "allowRetire": false,
    "focusMode": "restrict",
    "intentStrategy": "focus_only",
    "focus": {
      "mealArchetypes": [
        "dinner"
      ],
      "energyBandIds": [
        "kcal-700-799"
      ]
    }
  },
  "status": "planned",
  "stopReason": null,
  "plannedJobs": [
    {
      "jobId": "batch-87a611f808793a",
      "priority": 3.84822,
      "scoreBreakdown": {
        "nutrition": 0.9273,
        "meal": 0.875,
        "practicality": 0,
        "cuisine": 0,
        "ingredientDiversity": 0,
        "recipeFamily": 0,
        "focusBoost": 1,
        "similarityPenalty": 0,
        "ingredientOverusePenalty": 0,
        "pairRepetitionPenalty": 0
      },
      "targetIds": [
        "cell-dinner-kcal-700-799",
        "energy-kcal-700-799-density",
        "meal-dinner-coverage"
      ],
      "reasons": [
        "energy_band:dinner|kcal-700-799 deficit=0.927",
        "energy_band:kcal-700-799 deficit=0.293",
        "meal_archetype:dinner deficit=0.875",
        "user focus mode=restrict"
      ],
      "expectedAcceptedCount": 10
    }
  ],
  "createdAt": "2026-09-07T08:09:55.445Z",
  "completedAt": null
}
