{
  "schemaVersion": 1,
  "runId": "orchestration-expand-001",
  "mode": "expand",
  "plannerVersion": "corpus-planner-1",
  "policyId": "corpus-policy-v1-default",
  "policyVersion": "1.0.0",
  "inputSnapshotId": "snapshot-catalog-0.8.0-001",
  "outputSnapshotId": null,
  "seed": "expand-500-2026-09-03",
  "goal": {
    "targetRecipeCount": null,
    "acceptedAddCount": 500,
    "maxJobs": 8,
    "allowRetire": false,
    "focusMode": "boost",
    "focus": null
  },
  "status": "planned",
  "stopReason": null,
  "plannedJobs": [
    {
      "jobId": "batch-portable-breakfast-021",
      "priority": 2.04,
      "scoreBreakdown": {
        "nutrition": 0.42,
        "meal": 0.36,
        "practicality": 0.6,
        "cuisine": 0.08,
        "ingredientDiversity": 0.41,
        "recipeFamily": 0.22,
        "focusBoost": 0,
        "similarityPenalty": 0.06,
        "ingredientOverusePenalty": 0.08,
        "pairRepetitionPenalty": 0.03
      },
      "targetIds": [
        "meal-breakfast-min",
        "practical-portable-density"
      ],
      "reasons": [
        "portable coverage is below the release minimum",
        "breakfast remains under desired count",
        "selected ingredient subset improves primary-ingredient diversity"
      ],
      "expectedAcceptedCount": 100
    }
  ],
  "createdAt": "2026-09-03T10:20:00Z",
  "completedAt": null
}
