{
  "schemaVersion": 1,
  "runId": "orun-build-cae6a8980f7f",
  "mode": "build",
  "plannerVersion": "corpus-planner-1",
  "policyId": "corpus-policy-phase4-smoke",
  "policyVersion": "1.0.0",
  "inputSnapshotId": "snapshot-0.3.0-dev-82a94580d4f8",
  "outputSnapshotId": "snapshot-0.4.0-dev-4ed4b6a2ec5d",
  "seed": "phase4-smoke-seed",
  "goal": {
    "targetRecipeCount": 8,
    "acceptedAddCount": null,
    "maxJobs": null,
    "allowRetire": false,
    "focusMode": "boost",
    "focus": null
  },
  "status": "completed",
  "stopReason": "target_reached",
  "plannedJobs": [
    {
      "jobId": "batch-3835cf4f7db191",
      "priority": 1.105567,
      "scoreBreakdown": {
        "nutrition": 0,
        "meal": 0.625,
        "practicality": 0.6667,
        "cuisine": 0,
        "ingredientDiversity": 0,
        "recipeFamily": 0,
        "focusBoost": 0,
        "similarityPenalty": 0,
        "ingredientOverusePenalty": 0.555667,
        "pairRepetitionPenalty": 1
      },
      "targetIds": [
        "smoke-dinner",
        "smoke-portable"
      ],
      "reasons": [
        "meal_archetype:dinner deficit=0.625",
        "practicality:practical_portable deficit=0.667"
      ],
      "expectedAcceptedCount": 5
    }
  ],
  "createdAt": "2026-09-03T14:06:00Z",
  "completedAt": "2026-09-03T14:08:00Z"
}
